{
  "$schema": "https://json-schema.org/draft/2020-12/schema",
  "$id": "https://example.local/schemas/run_manifest_v1.json",
  "title": "run_manifest.v1",
  "type": "object",
  "required": [
    "contract",
    "run_id",
    "site_id",
    "started_at",
    "completed_at",
    "result",
    "run_status",
    "trust_level",
    "entity_counts",
    "artifacts"
  ],
  "properties": {
    "contract": {"const": "run_manifest.v1"},
    "run_id": {"type": "string"},
    "site_id": {"type": "string"},
    "started_at": {"type": "string"},
    "completed_at": {"type": "string"},
    "result": {"type": "string"},
    "run_status": {"type": "string"},
    "trust_level": {"type": "string"},
    "entity_counts": {"type": "object"},
    "artifacts": {"type": "array"},
    "notes": {"type": "array"},
    "promotion": {"type": "object"}
  },
  "additionalProperties": true
}
