{
  "contract": "run_manifest.v1",
  "run_id": "local_contract_check_20260424T161417Z",
  "site_id": "lcd.exactas.uba.ar",
  "started_at": "2026-04-24T16:14:17Z",
  "completed_at": "2026-04-24T16:14:17Z",
  "result": "pass",
  "run_status": "completed_trusted",
  "trust_level": "trusted",
  "entity_counts": {
    "page": 1,
    "post": 1
  },
  "artifacts": [
    {
      "path": "data/lcd/runs/local_contract_check_20260424T161417Z/normalized/page_doc.v1.jsonl",
      "kind": "normalized_page_jsonl",
      "sha256": "sha256:2137e9314451e437d19e19f2ad648959bcb051ebb8a46de67312303f423fcd58",
      "rows": 1
    },
    {
      "path": "data/lcd/runs/local_contract_check_20260424T161417Z/normalized/post_doc.v1.jsonl",
      "kind": "normalized_post_jsonl",
      "sha256": "sha256:976f6a878f5e6bbc616c7cd88e68113d2570621a85835877bb6615a55356cc8a",
      "rows": 1
    },
    {
      "path": "data/lcd/runs/local_contract_check_20260424T161417Z/chunks/page_chunk_doc.v1.jsonl",
      "kind": "chunks_page_jsonl",
      "sha256": "sha256:c8fcdaf91e717aa828fb9dc60248a28ccecdeb977093686612247d12b6aec442",
      "rows": 1
    },
    {
      "path": "data/lcd/runs/local_contract_check_20260424T161417Z/chunks/post_chunk_doc.v1.jsonl",
      "kind": "chunks_post_jsonl",
      "sha256": "sha256:a1bb3245509fed08f057821b23222ca161bcaabf1e66f3cbb6e6ec23de19cb4a",
      "rows": 1
    },
    {
      "path": "data/lcd/raw/pages",
      "kind": "raw_page",
      "files": 1
    },
    {
      "path": "data/lcd/raw/posts",
      "kind": "raw_post",
      "files": 1
    },
    {
      "path": "data/lcd/runs/local_contract_check_20260424T161417Z/staging/title_slug_index.json",
      "kind": "staging_title_slug_index",
      "rows": 2
    },
    {
      "path": "data/lcd/runs/local_contract_check_20260424T161417Z/reports/validation_report.json",
      "kind": "validation_report"
    },
    {
      "path": "data/lcd/runs/local_contract_check_20260424T161417Z/reports/drift_report.json",
      "kind": "drift_report"
    },
    {
      "path": "data/lcd/runs/local_contract_check_20260424T161417Z/registry/run_status.json",
      "kind": "run_status"
    },
    {
      "path": "data/lcd/runs/local_contract_check_20260424T161417Z/reports/anomalies/duplicate_source_urls.jsonl",
      "kind": "anomaly_duplicate_source_urls",
      "rows": 0
    },
    {
      "path": "data/lcd/runs/local_contract_check_20260424T161417Z/reports/anomalies/empty_text_docs.jsonl",
      "kind": "anomaly_empty_text_docs",
      "rows": 0
    },
    {
      "path": "data/lcd/runs/local_contract_check_20260424T161417Z/reports/anomalies/orphan_chunks.jsonl",
      "kind": "anomaly_orphan_chunks",
      "rows": 0
    },
    {
      "path": "data/lcd/runs/local_contract_check_20260424T161417Z/reports/anomalies/empty_chunks.jsonl",
      "kind": "anomaly_empty_chunks",
      "rows": 0
    },
    {
      "path": "data/lcd/runs/local_contract_check_20260424T161417Z/reports/anomalies/fetch_failures.jsonl",
      "kind": "anomaly_fetch_failures",
      "rows": 0
    },
    {
      "path": "data/lcd/runs/local_contract_check_20260424T161417Z/indexes/title_slug_index.json",
      "kind": "title_slug_index",
      "rows": 2
    }
  ],
  "notes": [
    "Manifest generated from current raw and normalized outputs.",
    "Validation passed; staged outputs were finalized and promoted as trusted."
  ],
  "promotion": {
    "latest_attempted": "data/lcd/registry/latest_attempted.json",
    "latest_success": "data/lcd/registry/latest_success.json",
    "latest_trusted": "data/lcd/registry/latest_trusted.json",
    "promoted": true
  }
}
